{
  "$schema": "https://json-schema.org/draft/2020-12/schema",
  "$id": "https://zaentrum.github.io/schemas/library/v2/item.schema.json",
  "title": "item.json — the identity of a library item",
  "description": "Written once, when the item is created, and never touched again: everything here is either true forever or the item is a different item. It is the only record that has to exist in an item folder, and it is written with a checksums.sha256 beside it that lists exactly item.json, so `sha256sum -c checksums.sha256` in the item folder proves the identity a rebuild trusts is the one that was written.\n\nLayout:\n  movies/<aa>/<itemId>/item.json, checksums.sha256\n  series/<aa>/<seriesId>/item.json, checksums.sha256, episodes/<episodeId>/item.json, checksums.sha256\n\n<aa> is the first two characters of the id. There is no title change here, no revision and no updatedAt: a renamed title is a database change that reaches storage through metadata.json, and everything that happens to the item after creation is a version, a package or an event.",
  "type": "object",
  "required": ["schema", "itemId", "type", "title", "createdAt"],
  "unevaluatedProperties": false,
  "allOf": [
    {
      "if": { "properties": { "type": { "const": "episode" } }, "required": ["type"] },
      "then": { "required": ["seriesId", "seasonNumber", "episodeNumber"] },
      "else": {
        "not": { "anyOf": [
          { "required": ["seriesId"] }, { "required": ["seasonNumber"] },
          { "required": ["episodeNumber"] }, { "required": ["episodeCode"] }
        ] }
      }
    }
  ],
  "properties": {
    "schema": { "const": "zaentrum.library.item/2" },
    "itemId": { "$ref": "defs.schema.json#/$defs/uuid", "description": "Equals the name of the folder this file sits in, and its first two characters are the shard folder." },
    "type": { "enum": ["movie", "series", "episode"] },
    "title": {
      "type": "string",
      "minLength": 1,
      "description": "The title as it was at creation, for human orientation in a folder listing. It is not the display title: that is projected into metadata.json and may differ."
    },
    "externalIds": { "$ref": "defs.schema.json#/$defs/externalIds", "description": "The reference ids the item was created with. Enough to fetch its texts and images again." },
    "createdAt": {
      "$ref": "defs.schema.json#/$defs/timestamp",
      "description": "When the item entered the library. It orders 'recently added', so it must survive every migration unchanged."
    },
    "createdBy": { "type": "string", "description": "The service or person that created the item." },

    "provenance": {
      "type": "object",
      "description": "How the item came to exist, when it came from somewhere else. It is part of the item's creation, so it is written once with the rest of this file and never revised. A tree built by migrating an old catalog keeps the old ids here, so what was already known about the item can still be found after the catalog it came from is gone.",
      "additionalProperties": false,
      "properties": {
        "migratedFrom": { "enum": ["legacy-catalog", "scan", "manual"] },
        "legacyItemId": { "$ref": "defs.schema.json#/$defs/uuid", "description": "The id the item had in the catalog it came from." },
        "migratedAt": { "$ref": "defs.schema.json#/$defs/timestamp" },
        "legacyCreatedBy": { "type": ["string", "null"] }
      }
    },

    "seriesId": { "$ref": "defs.schema.json#/$defs/uuid", "description": "Episode only: the series folder two levels up." },
    "seasonNumber": { "type": "integer", "minimum": 0, "description": "Episode only, aired order. 0 = specials." },
    "episodeNumber": { "type": "integer", "minimum": 0, "description": "Episode only, aired order." },
    "episodeCode": { "type": "string", "pattern": "^S[0-9]{2,}E[0-9]{2,}$", "description": "Episode only, e.g. 'S01E03'. Agrees with seasonNumber and episodeNumber." }
  }
}
