{
  "schema": "zaentrum.library.item/2",
  "itemId": "e0ab0b0d-3020-5d60-8404-448169bd4781",
  "type": "episode",
  "title": "Tailwind",
  "externalIds": {},
  "createdAt": "2026-09-18T09:00:00Z",
  "createdBy": "ingest example",
  "seriesId": "8dae7353-070a-5ff5-8ee3-a2d54615f984",
  "seasonNumber": 1,
  "episodeNumber": 4,
  "episodeCode": "S01E04"
}
