{
  "schema": "zaentrum.library.item/2",
  "itemId": "fb7dca21-b87b-5a41-af9f-a837fc5f0d1c",
  "type": "episode",
  "title": "Pilot",
  "externalIds": {},
  "createdAt": "2026-09-18T09:00:00Z",
  "createdBy": "ingest example",
  "seriesId": "8dae7353-070a-5ff5-8ee3-a2d54615f984",
  "seasonNumber": 1,
  "episodeNumber": 1,
  "episodeCode": "S01E01"
}
