{
  "schema": "zaentrum.library.item/2",
  "itemId": "c1b3ef5b-819d-57b4-a395-f8cec43ba6ca",
  "type": "episode",
  "title": "Headwind",
  "externalIds": {},
  "createdAt": "2026-09-18T09:00:00Z",
  "createdBy": "ingest example",
  "seriesId": "8dae7353-070a-5ff5-8ee3-a2d54615f984",
  "seasonNumber": 1,
  "episodeNumber": 3,
  "episodeCode": "S01E03"
}
